{"adapter_binding":{"adapter_id":"test-adapter","adapter_profile":"test-profile","adapter_version":"1.0.0","capabilities_digest":"56bf92ae18104d4616634a43810c3873e2a73c8c8063d3970fa12229d5542997","host_executable_fingerprint":"0d3917d207eee802aa7ba4e352eb8b3990d36cc19cd8753bff2685d8e5595c10","plugin_fingerprint":"bb2b5d56f0c113ac2fd57cf5ee7a7fbc39820dc24d4a04d25d5020017999b06c","plugin_id":"test-plugin","plugin_version":"1.0.0","protocol_major":1,"protocol_minor":0},"audit_binding":{"audit_id":"native-audit-c752652ee8c277c3c8299d11faf053a0","audit_integrity_sha256":"7b8f24843468bbec87c3158b3da14df730df5b8dc8742e536e27d2d212fd590c"},"created_at":"2026-08-05T17:44:16Z","geometry_document_binding_digest":"52252b59e3a8194c8f8207870b45f0cdf23f51b8d40fe3bab7266e01f46df5b4","integrity":{"algorithm":"SHA-256","sha256":"d39f9050756e77d85c48eb83a1e1020d9d7b5b2460819dc242efb8a45831e94d"},"intent_sha256":"a33fb25e2510995c8cda63ff5c9ca22977555edff79c7c090b8c406f7e5e2464","marker_policy_binding":{"enabled":false,"geometry_defaults":{"block_path":[],"overlay_evidence":{"corresponding_right_absent":false,"left_panel":false,"unique_content":false,"unsupported_data":true,"visible_interference":false},"space_kind":"modelspace"},"height_bits":"4004000000000000","layer":"REVIEW","layer_fingerprint":"b3b6039febc1ab8ac04076e32b7b2af0444a6e76164baba744a23e1e4545786a","plugin_capability":false,"policy_version":"marker-policy/v1","profile":"create_review_marker/v1","profile_enabled":false,"rotation_bits":"0000000000000000","style":"STANDARD","style_fingerprint":"edc92dc8b0b3f48a6893d4295c809499417bf4a4bccbef8aebd37877d1c4891c","text_derivation_version":"operation-id-suffix/v1","text_prefix":"LPF-REVIEW-"},"native_host_binding":"ba56e2f4f7299efeba6708432c5ce78b524a2a28b0b35a32b8efc3a451cdcb3c","operation_profiles":["translate_dbtext/v1"],"operations":[{"allowed_delta_digest":"afc96bd6c7240d8524a1692ce203613ac24fa98682a857cd21a6a564bdd37390","expected_before_geometry_fingerprint":"e72eecc33fec4651452cfd9759678294a88b7e8633053fa4d2dc8b369390225d","expected_before_opaque_state_digest":"38f879799a159064f75aed587d5b7b9a2b070918d5378922c4c6b4d4266eaa94","kind":"translate_dbtext","operation_id":"native-operation-aaaaaaaaaaaaaaaaaaaaaaaa","postcondition":"translated-exactly","profile":"translate_dbtext/v1","target_id":"native-target-635e3457576b2b313786bb9e"}],"plan_id":"native-plan-6ff0e9e890df13e9f4b7421a8c46481d","protected_state_digest":"994c3b38565d498b2a888a675e355430ef7b37966cb1420417e0329dcd3f7eb2","record_cardinality":"explicit_private","schema_version":"liang-pingfa/native-edit-plan/v1","source_binding":{"file_identity_fingerprint":"689f6a627384c7dcb2dcc1487e540223e77bdf9dcd0d8be8a326eda65b0ce9a4","path_fingerprint":"a0af9f865bf637e6736817f4ce552e4cdf7b8c36ea75bc254c1d1f0af744b5bf","sha256":"41cf6794ba4200b839c53531555f0f3998df4cbb01a4d5cb0b94e3ca5e23947d"}}
